{
  "$schema": "https://json-schema.org/draft/2020-12/schema",
  "$id": "https://seayinsights.github.io/multi_lingual_drivers_test/data/schemas/state.schema.json",
  "title": "State configuration file",
  "description": "Everything state-specific for one US state. Adding a state to the app means adding one file that validates against this schema — app code never changes. Design decisions: (1) all human-readable text is a localized-string object keyed by BCP-47 tag with en-US required, so new languages never change state files' shape; (2) passing rules use explicit integer minCorrect rather than only a percentage, eliminating rounding ambiguity (Ohio: 15 of 20 per section); (3) sections carry their own question counts and thresholds because several states (like Ohio) score sections independently.",
  "type": "object",
  "additionalProperties": false,
  "required": ["code", "name", "agency", "test", "licensing", "sources"],
  "properties": {
    "code": {
      "description": "USPS two-letter state code, lowercase.",
      "type": "string",
      "pattern": "^[a-z]{2}$"
    },
    "name": { "$ref": "#/$defs/localizedString" },
    "agency": {
      "type": "object",
      "additionalProperties": false,
      "required": ["name", "abbreviation", "website"],
      "properties": {
        "name": { "$ref": "#/$defs/localizedString" },
        "abbreviation": { "type": "string", "minLength": 2, "maxLength": 12 },
        "website": { "type": "string", "format": "uri", "pattern": "^https://" },
        "handbookUrl": { "type": "string", "format": "uri", "pattern": "^https://" }
      }
    },
    "test": {
      "type": "object",
      "additionalProperties": false,
      "required": ["totalQuestions", "passingRule", "sections", "timeLimitMinutes"],
      "properties": {
        "totalQuestions": { "type": "integer", "minimum": 1 },
        "passingRule": {
          "description": "per-section: every section's minCorrect must be met independently. overall: only the sum matters (sections still organize content).",
          "enum": ["per-section", "overall"]
        },
        "overallMinCorrect": {
          "description": "Required when passingRule is 'overall'.",
          "type": "integer",
          "minimum": 1
        },
        "timeLimitMinutes": {
          "description": "null means the real test is untimed.",
          "type": ["integer", "null"],
          "minimum": 1
        },
        "sections": {
          "type": "array",
          "minItems": 1,
          "items": {
            "type": "object",
            "additionalProperties": false,
            "required": ["id", "name", "questionCount", "minCorrect"],
            "properties": {
              "id": {
                "description": "Stable key questions reference via their 'section' field.",
                "type": "string",
                "pattern": "^[a-z][a-z0-9-]*$"
              },
              "name": { "$ref": "#/$defs/localizedString" },
              "questionCount": { "type": "integer", "minimum": 1 },
              "minCorrect": { "type": "integer", "minimum": 0 }
            }
          }
        }
      }
    },
    "licensing": {
      "type": "object",
      "additionalProperties": false,
      "required": ["minPermitAge"],
      "properties": {
        "minPermitAge": {
          "description": "Minimum age in years for a learner permit; fractional ages allowed (Ohio: 15.5).",
          "type": "number",
          "minimum": 14,
          "maximum": 18
        },
        "notes": { "$ref": "#/$defs/localizedString" }
      }
    },
    "content": {
      "description": "How this state's question bank is composed. Omitted entirely for states whose bank is fully self-authored (Ohio).",
      "type": "object",
      "additionalProperties": false,
      "properties": {
        "nationalSigns": {
          "description": "true: build-questions.mjs stamps the national MUTCD signs pool (data/questions/national-signs.json) into this state's bank with ids rewritten us-signs-NNN -> <code>-signs-NNN. The state's authoring batches then only need to cover state-specific content.",
          "type": "boolean"
        },
        "nationalRules": {
          "description": "true: build-questions.mjs stamps the national rules pool (data/questions/national-rules.json — universally-true US driving rules with no state-varying numbers) into this state's bank with ids rewritten us-rules-NNN -> <code>-rules-NNN. The state's authoring batches then only need to cover state-SPECIFIC numbers (speed limits, permit age, move-over mph, minor-BAC, penalties); those batches use ids <code>-rules-101+ to avoid collision with the stamped pool.",
          "type": "boolean"
        }
      }
    },
    "sources": {
      "description": "Citations backing every fact in this file. Reviewers verify against these.",
      "type": "array",
      "minItems": 1,
      "items": {
        "type": "object",
        "additionalProperties": false,
        "required": ["title", "url", "accessed"],
        "properties": {
          "title": { "type": "string", "minLength": 3 },
          "url": { "type": "string", "format": "uri", "pattern": "^https://" },
          "accessed": { "type": "string", "format": "date" }
        }
      }
    }
  },
  "$defs": {
    "localizedString": {
      "description": "Text keyed by BCP-47 language tag. en-US is always required as the fallback language.",
      "type": "object",
      "required": ["en-US"],
      "minProperties": 1,
      "properties": {
        "en-US": { "type": "string", "minLength": 1 }
      },
      "propertyNames": { "pattern": "^[a-z]{2,3}-[A-Z]{2}$" },
      "additionalProperties": { "type": "string", "minLength": 1 }
    }
  }
}
