{
  "code": "la",
  "name": {
    "en-US": "Louisiana",
    "vi-VN": "Louisiana"
  },
  "agency": {
    "name": {
      "en-US": "Louisiana Office of Motor Vehicles",
      "vi-VN": "Nha Lộ Vận Louisiana (OMV)"
    },
    "abbreviation": "OMV",
    "website": "https://expresslane.dps.louisiana.gov",
    "handbookUrl": "https://expresslane.dps.louisiana.gov"
  },
  "test": {
    "totalQuestions": 40,
    "passingRule": "overall",
    "overallMinCorrect": 32,
    "timeLimitMinutes": null,
    "sections": [
      {
        "id": "signs",
        "name": {
          "en-US": "Road signs",
          "vi-VN": "Biển báo giao thông"
        },
        "questionCount": 15,
        "minCorrect": 0
      },
      {
        "id": "rules",
        "name": {
          "en-US": "Road rules",
          "vi-VN": "Luật giao thông"
        },
        "questionCount": 25,
        "minCorrect": 0
      }
    ]
  },
  "licensing": {
    "minPermitAge": 15,
    "notes": {
      "en-US": "The Class E knowledge test has 40 questions; you must score 80% (32 of 40) to pass. A learner's permit is available from age 15 (graduated licensing). Practice in English-only mode if your test center administers the test in English.",
      "vi-VN": "Bài thi lý thuyết hạng E có 40 câu; phải đúng 80% (32/40) mới đậu. Có thể lấy giấy phép tập lái từ 15 tuổi (chương trình cấp bằng theo giai đoạn). Nên luyện ở chế độ chỉ tiếng Anh nếu trung tâm thi bằng tiếng Anh."
    }
  },
  "content": {
    "nationalSigns": true
  },
  "sources": [
    {
      "title": "Louisiana OMV — Class E Learner's Permit Requirements (40 questions, 80% to pass, permit age 15)",
      "url": "https://expresslane.dps.louisiana.gov/CDLForms/CLASS%20E%20Learner's%20Permit%20requirements.pdf",
      "accessed": "2026-07-19"
    }
  ]
}
