{
  "code": "ia",
  "name": {
    "en-US": "Iowa",
    "vi-VN": "Iowa"
  },
  "agency": {
    "name": {
      "en-US": "Iowa Department of Transportation, Motor Vehicle Division",
      "vi-VN": "Nha Lộ Vận Iowa (Iowa DOT)"
    },
    "abbreviation": "DOT",
    "website": "https://iowadot.gov",
    "handbookUrl": "https://iowadot.gov/drivers-licenses-ids/driver-education/manuals-practice-tests/drivers-manual"
  },
  "test": {
    "totalQuestions": 25,
    "passingRule": "overall",
    "overallMinCorrect": 20,
    "timeLimitMinutes": null,
    "sections": [
      {
        "id": "signs",
        "name": {
          "en-US": "Road signs",
          "vi-VN": "Biển báo giao thông"
        },
        "questionCount": 10,
        "minCorrect": 0
      },
      {
        "id": "rules",
        "name": {
          "en-US": "Road rules",
          "vi-VN": "Luật giao thông"
        },
        "questionCount": 15,
        "minCorrect": 0
      }
    ]
  },
  "licensing": {
    "minPermitAge": 14,
    "notes": {
      "en-US": "Iowa requires 80% to pass; the official real-test question count is not published (the practice test uses 25 questions), so this simulation uses 25 questions (20 correct = 80%). An instruction permit is available from age 14. Iowa DOT offers the manual and a study guide in Vietnamese, plus the knowledge test with an interpreter by appointment.",
      "vi-VN": "Iowa yêu cầu đúng 80% mới đậu; số câu bài thi thật không được công bố (bài luyện dùng 25 câu), nên bản mô phỏng này dùng 25 câu (đúng 20 = 80%). Có thể lấy giấy phép tập lái từ 14 tuổi. Iowa DOT có sổ tay và tài liệu ôn bằng tiếng Việt, và cho thi kèm thông dịch viên khi hẹn trước."
    }
  },
  "content": {
    "nationalSigns": true
  },
  "sources": [
    {
      "title": "Iowa DOT — Practice Test / knowledge test (80% to pass)",
      "url": "https://iowadot.gov/drivers-licenses-ids/driver-education/manuals-practice-tests/take-practice-test",
      "accessed": "2026-07-19"
    },
    {
      "title": "Iowa DOT — Instruction Permit under 18 (age 14)",
      "url": "https://iowadot.gov/drivers-licenses-ids/get-or-renew-drivers-licenses-ids-permits/under-18-permit-license-or-id/instruction-permit-under-age-18",
      "accessed": "2026-07-19"
    }
  ]
}
