{
  "code": "mt",
  "name": {
    "en-US": "Montana",
    "vi-VN": "Montana"
  },
  "agency": {
    "name": {
      "en-US": "Montana Motor Vehicle Division (Department of Justice)",
      "vi-VN": "Nha Lộ Vận Montana (MVD)"
    },
    "abbreviation": "MVD",
    "website": "https://mvdmt.gov",
    "handbookUrl": "https://mvdmt.gov/wp-content/uploads/2026/05/25-0100M-Montana-Driver-Manual-English-05.26.pdf"
  },
  "test": {
    "totalQuestions": 25,
    "passingRule": "overall",
    "overallMinCorrect": 20,
    "timeLimitMinutes": null,
    "sections": [
      {
        "id": "signs",
        "name": {
          "en-US": "Road signs",
          "vi-VN": "Biển báo giao thông"
        },
        "questionCount": 10,
        "minCorrect": 0
      },
      {
        "id": "rules",
        "name": {
          "en-US": "Road rules",
          "vi-VN": "Luật giao thông"
        },
        "questionCount": 15,
        "minCorrect": 0
      }
    ]
  },
  "licensing": {
    "minPermitAge": 14.5,
    "notes": {
      "en-US": "Montana's manual does not publish an official question count or passing score, so this practice test uses a common 25-question / 80% standard (this state stays in draft until verified). A Non-Commercial Learner Permit is available from age 14½ with a traffic-education program. Note: the test is offered in English and Spanish — practice in English-only mode.",
      "vi-VN": "Sổ tay Montana không công bố số câu hay điểm đậu chính thức, nên bản luyện này dùng chuẩn phổ biến 25 câu / 80% (còn ở dạng nháp cho tới khi xác minh). Có thể lấy giấy phép tập lái từ 14 tuổi rưỡi kèm chương trình học lái xe. Lưu ý: bài thi có tiếng Anh và tiếng Tây Ban Nha — nên luyện ở chế độ chỉ tiếng Anh."
    }
  },
  "content": {
    "nationalSigns": true
  },
  "sources": [
    {
      "title": "Montana Driver Manual (May 2026; count/score not stated)",
      "url": "https://mvdmt.gov/wp-content/uploads/2026/05/25-0100M-Montana-Driver-Manual-English-05.26.pdf",
      "accessed": "2026-07-19"
    }
  ]
}
