{
  "code": "il",
  "name": {
    "en-US": "Illinois",
    "vi-VN": "Illinois"
  },
  "agency": {
    "name": {
      "en-US": "Illinois Secretary of State, Driver Services",
      "vi-VN": "Nha Lộ Vận Illinois (SOS)"
    },
    "abbreviation": "SOS",
    "website": "https://www.ilsos.gov",
    "handbookUrl": "https://www.ilsos.gov/content/dam/publications/pdf_publications/dsd_a112.pdf"
  },
  "test": {
    "totalQuestions": 35,
    "passingRule": "overall",
    "overallMinCorrect": 28,
    "timeLimitMinutes": null,
    "sections": [
      {
        "id": "signs",
        "name": {
          "en-US": "Road signs",
          "vi-VN": "Biển báo giao thông"
        },
        "questionCount": 15,
        "minCorrect": 0
      },
      {
        "id": "rules",
        "name": {
          "en-US": "Road rules",
          "vi-VN": "Luật giao thông"
        },
        "questionCount": 20,
        "minCorrect": 0
      }
    ]
  },
  "licensing": {
    "minPermitAge": 15,
    "notes": {
      "en-US": "The written exam has 35 questions — 15 on traffic-sign identification and 20 multiple-choice/true-false. Illinois publishes an 80% pass mark only for CDL tests; the standard-license passing score is not officially stated, so this simulation uses 80% (28 of 35) and stays in draft until verified. An instruction permit is available from age 15 with an approved driver-education course.",
      "vi-VN": "Bài thi viết có 35 câu — 15 câu nhận biết biển báo và 20 câu trắc nghiệm/đúng-sai. Illinois chỉ công bố mức đậu 80% cho bằng CDL; điểm đậu bằng thường không nêu chính thức, nên bản mô phỏng này dùng 80% (28/35) và còn ở dạng nháp cho tới khi xác minh. Có thể lấy giấy phép tập lái từ 15 tuổi kèm khóa học lái xe được công nhận."
    }
  },
  "content": {
    "nationalSigns": true,
    "nationalRules": true
  },
  "sources": [
    {
      "title": "Illinois SOS — Rules of the Road Review Workbook (35 questions: 15 signs + 20)",
      "url": "https://www.ilsos.gov/content/dam/publications/pdf_publications/dsd_ds9.pdf",
      "accessed": "2026-07-19"
    },
    {
      "title": "Illinois SOS — Instruction Permit (age 15 w/ driver-ed)",
      "url": "https://www.ilsos.gov/departments/drivers/driver-education/instructpermit.html",
      "accessed": "2026-07-19"
    }
  ]
}
