{
  "code": "sc",
  "name": {
    "en-US": "South Carolina",
    "vi-VN": "South Carolina"
  },
  "agency": {
    "name": {
      "en-US": "South Carolina Department of Motor Vehicles",
      "vi-VN": "Nha Lộ Vận South Carolina (SCDMV)"
    },
    "abbreviation": "SCDMV",
    "website": "https://dmv.sc.gov",
    "handbookUrl": "https://dmv.sc.gov/sites/scdmv/files/2026-01/Drivers%20Manual.pdf"
  },
  "test": {
    "totalQuestions": 30,
    "passingRule": "overall",
    "overallMinCorrect": 24,
    "timeLimitMinutes": null,
    "sections": [
      {
        "id": "signs",
        "name": {
          "en-US": "Road signs",
          "vi-VN": "Biển báo giao thông"
        },
        "questionCount": 10,
        "minCorrect": 0
      },
      {
        "id": "rules",
        "name": {
          "en-US": "Road rules",
          "vi-VN": "Luật giao thông"
        },
        "questionCount": 20,
        "minCorrect": 0
      }
    ]
  },
  "licensing": {
    "minPermitAge": 15,
    "notes": {
      "en-US": "South Carolina does not publish an official question count or passing score, so this practice test uses a common 30-question / 80% standard (this state stays in draft until the official format is verified). A beginner's permit is available from age 15.",
      "vi-VN": "South Carolina không công bố số câu hay điểm đậu chính thức, nên bản luyện này dùng chuẩn phổ biến 30 câu / 80% (còn ở dạng nháp cho tới khi xác minh định dạng chính thức). Có thể lấy giấy phép tập lái từ 15 tuổi."
    }
  },
  "content": {
    "nationalSigns": true,
    "nationalRules": true
  },
  "sources": [
    {
      "title": "SCDMV — Beginner's Permits (age 15; count/score not published)",
      "url": "https://dmv.sc.gov/driver-services/drivers-license/beginner-permits",
      "accessed": "2026-07-19"
    },
    {
      "title": "South Carolina Driver's Manual (Jan 2026 edition)",
      "url": "https://dmv.sc.gov/sites/scdmv/files/2026-01/Drivers%20Manual.pdf",
      "accessed": "2026-07-19"
    }
  ]
}
