{
  "code": "nv",
  "name": {
    "en-US": "Nevada",
    "vi-VN": "Nevada"
  },
  "agency": {
    "name": {
      "en-US": "Nevada Department of Motor Vehicles",
      "vi-VN": "Nha Lộ Vận Nevada (DMV)"
    },
    "abbreviation": "DMV",
    "website": "https://dmv.nv.gov",
    "handbookUrl": "https://dmv.nv.gov/pdfforms/dlbook.pdf"
  },
  "test": {
    "totalQuestions": 25,
    "passingRule": "overall",
    "overallMinCorrect": 20,
    "timeLimitMinutes": null,
    "sections": [
      {
        "id": "signs",
        "name": {
          "en-US": "Road signs",
          "vi-VN": "Biển báo giao thông"
        },
        "questionCount": 10,
        "minCorrect": 0
      },
      {
        "id": "rules",
        "name": {
          "en-US": "Road rules",
          "vi-VN": "Luật giao thông"
        },
        "questionCount": 15,
        "minCorrect": 0
      }
    ]
  },
  "licensing": {
    "minPermitAge": 15.5,
    "notes": {
      "en-US": "The Class C knowledge test has 25 multiple-choice questions; 80% (20 correct) passes and the test stops at 20 correct or 6 wrong. An instruction permit is available from age 15½. Note: Nevada's real test is offered in English and Spanish only — practice in English-only mode to prepare.",
      "vi-VN": "Bài thi lý thuyết hạng C có 25 câu trắc nghiệm; đúng 80% (20 câu) là đậu, bài dừng khi đạt 20 câu đúng hoặc 6 câu sai. Có thể lấy giấy phép tập lái từ 15 tuổi rưỡi. Lưu ý: bài thi thật ở Nevada CHỈ có tiếng Anh và tiếng Tây Ban Nha — nên luyện ở chế độ chỉ tiếng Anh để chuẩn bị."
    }
  },
  "content": {
    "nationalSigns": true,
    "nationalRules": true
  },
  "sources": [
    {
      "title": "Nevada DMV — Drive Testing (25 questions, 80%, stops at 20 correct/6 wrong, EN/ES only)",
      "url": "https://dmv.nv.gov/dltesting.htm",
      "accessed": "2026-07-19"
    },
    {
      "title": "Nevada DMV — Teen instruction permit (age 15½)",
      "url": "https://dmv.nv.gov/dlipteens.htm",
      "accessed": "2026-07-19"
    }
  ]
}
