{
  "code": "pa",
  "name": {
    "en-US": "Pennsylvania",
    "vi-VN": "Pennsylvania"
  },
  "agency": {
    "name": {
      "en-US": "Pennsylvania Department of Transportation, Driver & Vehicle Services",
      "vi-VN": "Nha Lộ Vận Pennsylvania (PennDOT)"
    },
    "abbreviation": "PennDOT",
    "website": "https://www.pa.gov/agencies/dmv",
    "handbookUrl": "https://www.pa.gov/agencies/dmv/driver-services/pennsylvania-drivers-manual"
  },
  "test": {
    "totalQuestions": 18,
    "passingRule": "overall",
    "overallMinCorrect": 15,
    "timeLimitMinutes": null,
    "sections": [
      {
        "id": "signs",
        "name": {
          "en-US": "Road signs",
          "vi-VN": "Biển báo giao thông"
        },
        "questionCount": 6,
        "minCorrect": 0
      },
      {
        "id": "rules",
        "name": {
          "en-US": "Road rules",
          "vi-VN": "Luật giao thông"
        },
        "questionCount": 12,
        "minCorrect": 0
      }
    ]
  },
  "licensing": {
    "minPermitAge": 16,
    "notes": {
      "en-US": "The knowledge test has 18 multiple-choice questions; you must answer 15 correctly to pass. A learner's permit is available from age 16. PennDOT offers the knowledge test in Vietnamese (written and audio) upon request.",
      "vi-VN": "Bài thi lý thuyết có 18 câu trắc nghiệm; phải đúng 15 câu mới đậu. Có thể lấy giấy phép tập lái từ 16 tuổi. PennDOT có bài thi bằng tiếng Việt (chữ viết và âm thanh) khi yêu cầu."
    }
  },
  "content": {
    "nationalSigns": true,
    "nationalRules": true
  },
  "sources": [
    {
      "title": "PennDOT — Driver's Manual Testing (18 questions, 15 to pass, Vietnamese on request)",
      "url": "https://www.pa.gov/agencies/dmv/driver-services/pennsylvania-drivers-manual/online-drivers-manual/testing",
      "accessed": "2026-07-19"
    }
  ]
}
