{
  "code": "nc",
  "name": {
    "en-US": "North Carolina",
    "vi-VN": "North Carolina"
  },
  "agency": {
    "name": {
      "en-US": "North Carolina Division of Motor Vehicles",
      "vi-VN": "Nha Lộ Vận North Carolina (NCDMV)"
    },
    "abbreviation": "NCDMV",
    "website": "https://www.ncdot.gov/dmv",
    "handbookUrl": "https://www.ncdot.gov/dmv/license-id/driver-licenses/new-drivers/Documents/driver-handbook.pdf"
  },
  "test": {
    "totalQuestions": 25,
    "passingRule": "overall",
    "overallMinCorrect": 20,
    "timeLimitMinutes": null,
    "sections": [
      {
        "id": "signs",
        "name": {
          "en-US": "Road signs",
          "vi-VN": "Biển báo giao thông"
        },
        "questionCount": 10,
        "minCorrect": 0
      },
      {
        "id": "rules",
        "name": {
          "en-US": "Road rules",
          "vi-VN": "Luật giao thông"
        },
        "questionCount": 15,
        "minCorrect": 0
      }
    ]
  },
  "licensing": {
    "minPermitAge": 15,
    "notes": {
      "en-US": "North Carolina's rule sets an 80% pass threshold and a separate road-sign test (identify 9 of 12 signs); it does not publish a fixed knowledge-question count, so this simulation uses 25 questions (20 correct = 80%). A limited learner permit is available from age 15 with a driver-education certificate.",
      "vi-VN": "Quy định North Carolina đặt mức đậu 80% và một bài nhận biết biển báo riêng (đúng 9/12 biển); tiểu bang không công bố số câu cố định, nên bản mô phỏng này dùng 25 câu (đúng 20 câu = 80%). Có thể lấy giấy phép tập lái giới hạn từ 15 tuổi kèm chứng chỉ học lái xe."
    }
  },
  "content": {
    "nationalSigns": true
  },
  "sources": [
    {
      "title": "NCDMV rule 19A NCAC 03B .0201 (80% to pass; 9 of 12 road signs; count not fixed)",
      "url": "https://www.ncdot.gov/about-us/how-we-operate/policy-process/rules/Documents/19b-ncac-03b-201.pdf",
      "accessed": "2026-07-19"
    },
    {
      "title": "NCDMV — Driver License Tests (permit age 15)",
      "url": "https://www.ncdot.gov/dmv/license-id/driver-licenses/new-drivers/Pages/driver-license-tests.aspx",
      "accessed": "2026-07-19"
    }
  ]
}
