{
  "code": "in",
  "name": {
    "en-US": "Indiana",
    "vi-VN": "Indiana"
  },
  "agency": {
    "name": {
      "en-US": "Indiana Bureau of Motor Vehicles",
      "vi-VN": "Nha Lộ Vận Indiana (BMV)"
    },
    "abbreviation": "BMV",
    "website": "https://www.in.gov/bmv",
    "handbookUrl": "https://www.in.gov/bmv/licenses-permits-ids/files/drivers-manual.pdf"
  },
  "test": {
    "totalQuestions": 25,
    "passingRule": "per-section",
    "timeLimitMinutes": null,
    "sections": [
      {
        "id": "signs",
        "name": {
          "en-US": "Traffic signs",
          "vi-VN": "Biển báo giao thông"
        },
        "questionCount": 10,
        "minCorrect": 8
      },
      {
        "id": "rules",
        "name": {
          "en-US": "Traffic maneuvers",
          "vi-VN": "Luật và thao tác lái xe"
        },
        "questionCount": 15,
        "minCorrect": 12
      }
    ]
  },
  "licensing": {
    "minPermitAge": 15,
    "notes": {
      "en-US": "Indiana's knowledge exam has two components — traffic signs and traffic maneuvers — and you must score 80% on EACH. The BMV does not publish a question count, so this simulation uses 10 sign + 15 maneuver questions (8 and 12 to pass). A learner's permit is available from age 15 with driver-education enrollment (16 without). The BMV offers the knowledge exam in Vietnamese.",
      "vi-VN": "Bài thi Indiana có hai phần — biển báo và luật/thao tác lái xe — và phải đúng 80% ở MỖI phần. BMV không công bố số câu, nên bản mô phỏng này dùng 10 câu biển báo + 15 câu luật (đúng 8 và 12 để đậu). Có thể lấy giấy phép tập lái từ 15 tuổi nếu ghi danh học lái xe (16 tuổi nếu không). BMV có bài thi bằng tiếng Việt."
    }
  },
  "content": {
    "nationalSigns": true,
    "nationalRules": true
  },
  "sources": [
    {
      "title": "Indiana BMV — Knowledge Exam (two components, 80% each, Vietnamese offered)",
      "url": "https://www.in.gov/bmv/licenses-permits-ids/learners-permits-and-drivers-licenses-overview/learners-permit/knowledge-exam",
      "accessed": "2026-07-19"
    },
    {
      "title": "Indiana BMV — Learner's Permit (age 15 w/ driver-ed)",
      "url": "https://www.in.gov/bmv/licenses-permits-ids/learners-permits-and-drivers-licenses-overview/learners-permit/",
      "accessed": "2026-07-19"
    }
  ]
}
