{
  "code": "nd",
  "name": {
    "en-US": "North Dakota",
    "vi-VN": "North Dakota"
  },
  "agency": {
    "name": {
      "en-US": "North Dakota Department of Transportation",
      "vi-VN": "Nha Lộ Vận North Dakota (NDDOT)"
    },
    "abbreviation": "NDDOT",
    "website": "https://www.dot.nd.gov/driver",
    "handbookUrl": "https://www.dot.nd.gov/sites/www/files/documents/Drivers%20-%20documents/noncommercial-manual.pdf"
  },
  "test": {
    "totalQuestions": 25,
    "passingRule": "overall",
    "overallMinCorrect": 20,
    "timeLimitMinutes": null,
    "sections": [
      {
        "id": "signs",
        "name": {
          "en-US": "Road signs",
          "vi-VN": "Biển báo giao thông"
        },
        "questionCount": 10,
        "minCorrect": 0
      },
      {
        "id": "rules",
        "name": {
          "en-US": "Road rules",
          "vi-VN": "Luật giao thông"
        },
        "questionCount": 15,
        "minCorrect": 0
      }
    ]
  },
  "licensing": {
    "minPermitAge": 14,
    "notes": {
      "en-US": "North Dakota's manual does not publish an official question count or passing score, so this practice test uses a common 25-question / 80% standard (this state stays in draft until verified). An instruction permit is available from age 14. NDDOT offers the Class D knowledge test in Vietnamese.",
      "vi-VN": "Sổ tay North Dakota không công bố số câu hay điểm đậu chính thức, nên bản luyện này dùng chuẩn phổ biến 25 câu / 80% (còn ở dạng nháp cho tới khi xác minh). Có thể lấy giấy phép tập lái từ 14 tuổi. NDDOT có bài thi hạng D bằng tiếng Việt."
    }
  },
  "content": {
    "nationalSigns": true,
    "nationalRules": true
  },
  "sources": [
    {
      "title": "North Dakota Noncommercial Driver License Manual 2025-2027 (Vietnamese offered; count/score not stated)",
      "url": "https://www.dot.nd.gov/sites/www/files/documents/Drivers%20-%20documents/noncommercial-manual.pdf",
      "accessed": "2026-07-19"
    }
  ]
}
