{
  "code": "me",
  "name": {
    "en-US": "Maine",
    "vi-VN": "Maine"
  },
  "agency": {
    "name": {
      "en-US": "Maine Bureau of Motor Vehicles",
      "vi-VN": "Nha Lộ Vận Maine (BMV)"
    },
    "abbreviation": "BMV",
    "website": "https://www.maine.gov/sos/bmv",
    "handbookUrl": "https://www.maine.gov/sos/sites/maine.gov.sos/files/inline-files/motoristhandbook.pdf"
  },
  "test": {
    "totalQuestions": 30,
    "passingRule": "overall",
    "overallMinCorrect": 24,
    "timeLimitMinutes": null,
    "sections": [
      {
        "id": "signs",
        "name": {
          "en-US": "Road signs",
          "vi-VN": "Biển báo giao thông"
        },
        "questionCount": 10,
        "minCorrect": 0
      },
      {
        "id": "rules",
        "name": {
          "en-US": "Road rules",
          "vi-VN": "Luật giao thông"
        },
        "questionCount": 20,
        "minCorrect": 0
      }
    ]
  },
  "licensing": {
    "minPermitAge": 15,
    "notes": {
      "en-US": "The knowledge test has 30 questions; you must answer at least 24 correctly to pass. A permit is available from age 15 (driver-ed certificate required under 18). Note: the standard test is offered in 8 languages not including Vietnamese — a free interpreter is available; practice in English-only mode.",
      "vi-VN": "Bài thi lý thuyết có 30 câu; phải đúng ít nhất 24 câu mới đậu. Có thể lấy giấy phép từ 15 tuổi (dưới 18 cần chứng chỉ học lái xe). Lưu ý: bài thi chuẩn có 8 thứ tiếng, không có tiếng Việt — có thông dịch viên miễn phí; nên luyện ở chế độ chỉ tiếng Anh."
    }
  },
  "content": {
    "nationalSigns": true
  },
  "sources": [
    {
      "title": "Maine BMV — Driver's License Exam (30 questions, 24 to pass)",
      "url": "https://www.maine.gov/sos/bmv/driver-licenses-and-ids/car-license/drivers-license-exam",
      "accessed": "2026-07-19"
    },
    {
      "title": "Maine BMV — How to Obtain a License (permit age 15)",
      "url": "https://www.maine.gov/sos/bmv/driver-licenses-and-ids/car-license/how-to-obtain-a-license",
      "accessed": "2026-07-19"
    }
  ]
}
