{
  "code": "sd",
  "name": {
    "en-US": "South Dakota",
    "vi-VN": "South Dakota"
  },
  "agency": {
    "name": {
      "en-US": "South Dakota Department of Public Safety",
      "vi-VN": "Nha Lộ Vận South Dakota (SD DPS)"
    },
    "abbreviation": "DPS",
    "website": "https://dps.sd.gov/driver-licensing",
    "handbookUrl": "https://dps.sd.gov/application/files/9717/0863/8492/sd-driver-manual-rev-12-2023.pdf"
  },
  "test": {
    "totalQuestions": 25,
    "passingRule": "overall",
    "overallMinCorrect": 20,
    "timeLimitMinutes": null,
    "sections": [
      {
        "id": "signs",
        "name": {
          "en-US": "Road signs",
          "vi-VN": "Biển báo giao thông"
        },
        "questionCount": 10,
        "minCorrect": 0
      },
      {
        "id": "rules",
        "name": {
          "en-US": "Road rules",
          "vi-VN": "Luật giao thông"
        },
        "questionCount": 15,
        "minCorrect": 0
      }
    ]
  },
  "licensing": {
    "minPermitAge": 14,
    "notes": {
      "en-US": "South Dakota does not publish an official question count or passing score, so this practice test uses a common 25-question / 80% standard (this state stays in draft until verified). An instruction permit is available from age 14.",
      "vi-VN": "South Dakota không công bố số câu hay điểm đậu chính thức, nên bản luyện này dùng chuẩn phổ biến 25 câu / 80% (còn ở dạng nháp cho tới khi xác minh). Có thể lấy giấy phép tập lái từ 14 tuổi."
    }
  },
  "content": {
    "nationalSigns": true
  },
  "sources": [
    {
      "title": "South Dakota Driver License Manual (rev. Dec 2023; count/score not stated)",
      "url": "https://dps.sd.gov/application/files/9717/0863/8492/sd-driver-manual-rev-12-2023.pdf",
      "accessed": "2026-07-19"
    }
  ]
}
